{
  "paper_id": "b942ff4c-3106-4a12-a9ef-68fb884ec585",
  "metadata": {
    "title": null,
    "authors": null,
    "year": null,
    "venue": null,
    "doi": null,
    "arxiv_id": null
  },
  "key_ideas": [
    {
      "text": "(2) The base model entropy- accuracy relationship is reshaped: for Mbase, higher en- tropy monotonically reduces accuracy, but for MRL-base, ac- curacy first declines then recovers with increasing entropy, as shown in Figure 6(b), indicating that moderate uncer- tainty supports productive exploration.",
      "section": "pdf_page",
      "page": 8,
      "source": "pdf",
      "cues": [
        "first"
      ],
      "evidence": [
        {
          "text": "On the Uncertainty of Large Language Model-Based Multi-Agent Systems AIME24 AIME25 HE Math500 MMLU GSM8K Dataset 0 20 40 60 80 100 Accuracy (%) (a) base centralized debate hybrid sequential single 0 20 40 60 80 Base Model Entropy 50 60 70 80 Accuracy (%) (b) centralized debate hybrid sequential single Qwen-2.5-7B-RL (Base) 0 25 50 75 100 125 150 Round 2 Total Entropy 0 20 40 60 80 100 120 Round 1 Median Agent Entropy (c) SAS Negative MAS Negative SAS Positive MAS Positive Figure 6.",
          "section": "pdf_page",
          "page": 8,
          "source": "pdf"
        },
        {
          "text": "Figure 6 highlights three findings.",
          "section": "pdf_page",
          "page": 8,
          "source": "pdf"
        },
        {
          "text": "(3) On GMAS, the top predictors are round-1 median entropy (\u03c1 \u2248\u22120.758) and round-2 entropy (\u03c1 \u22480.267), as shown in Figure 6(c), sug- gesting early convergence is beneficial, while later entropy reflects refinement rather than noise.",
          "section": "pdf_page",
          "page": 8,
          "source": "pdf"
        },
        {
          "text": "Further comparison across Figure 2(b,d) and Figure 6(b) shows that MRL-base achieves both lower entropy and higher correctness than Mbase.",
          "section": "pdf_page",
          "page": 8,
          "source": "pdf"
        },
        {
          "text": "Uncertainty Predicts MAS Correctness The Entropy Judger achieves strong classification accuracy using only MAS-derived entropy features from GMAS, as shown in Table 1, demonstrating that uncertainty dynamics Table 1.",
          "section": "pdf_page",
          "page": 8,
          "source": "pdf"
        }
      ],
      "scores": {
        "novelty": 0.8,
        "evidence": 1.0,
        "neuroscience": 0.3,
        "section_weight": 0.8,
        "total": 0.76
      }
    },
    {
      "text": "These case studies provide visual evidence for our main findings: (1) Round-1 dynamics are critical: entropy patterns established in the first round largely persist or determine the trajectory in round 2; (2) Moderate, stable entropy correlates with success: both excessively high entropy (erratic reasoning) and near-zero entropy (premature collapse) predict failure; (3) Model family shapes uncertainty style: Qwen and LLaMA exhibit distinct entropy profiles that influence MAS effectiveness across different tasks.",
      "section": "pdf_page",
      "page": 28,
      "source": "pdf",
      "cues": [
        "first"
      ],
      "evidence": [
        {
          "text": "In each figure, white backgrounds denote round 1 and gray backgrounds denote round 2.",
          "section": "pdf_page",
          "page": 28,
          "source": "pdf"
        },
        {
          "text": "Figure 17 shows that the smallest Qwen model exhibits persistently high entropy across both rounds, with frequent spikes throughout the reasoning trajectory.",
          "section": "pdf_page",
          "page": 28,
          "source": "pdf"
        },
        {
          "text": "Notably, even when round-2 entropy decreases, it often collapses to near-zero rather than converging to a stable moderate level, indicating premature termination rather than confident resolution.",
          "section": "pdf_page",
          "page": 28,
          "source": "pdf"
        },
        {
          "text": "Figure 18 reveals that scaling to 4B parameters improves entropy stability.",
          "section": "pdf_page",
          "page": 28,
          "source": "pdf"
        },
        {
          "text": "On simpler tasks (GSM8K, MMLU), agents converge to low, stable entropy in round 2, yielding correct predictions.",
          "section": "pdf_page",
          "page": 28,
          "source": "pdf"
        },
        {
          "text": "Figure 19 demonstrates that the largest Qwen model exhibits the most structured entropy dynamics.",
          "section": "pdf_page",
          "page": 28,
          "source": "pdf"
        },
        {
          "text": "Figure 20 shows that LLaMA models exhibit fundamentally different entropy dynamics compared to Qwen.",
          "section": "pdf_page",
          "page": 28,
          "source": "pdf"
        },
        {
          "text": "Figure 21 reveals that scaling LLaMA to 8B parameters improves overall accuracy but preserves the characteristic low-entropy style in round 2.",
          "section": "pdf_page",
          "page": 28,
          "source": "pdf"
        }
      ],
      "scores": {
        "novelty": 0.8,
        "evidence": 1.0,
        "neuroscience": 0.3,
        "section_weight": 0.8,
        "total": 0.76
      }
    },
    {
      "text": "Prior work shows MAS performance depends on Mbase capa- bility (Zhang et al., 2025c), a trend we also observe in Figure 1; moreover, we find that Mbase uncertainty further constrains MAS effectiveness.",
      "section": "pdf_page",
      "page": 4,
      "source": "pdf",
      "cues": [
        "we find"
      ],
      "evidence": [
        {
          "text": "On the Uncertainty of Large Language Model-Based Multi-Agent Systems L-3 L-8 Q-0.6 Q-4 Q-8 Model 0.0 0.2 0.4 0.6 0.8 Accuracy AIME24 base centralized debate hybrid sequential single L-3 L-8 Q-0.6 Q-4 Q-8 Model 0.0 0.2 0.4 0.6 AIME25 L-3 L-8 Q-0.6 Q-4 Q-8 Model 0.0 0.2 0.4 0.6 0.8 1.0 GSM8K L-3 L-8 Q-0.6 Q-4 Q-8 Model 0.0 0.2 0.4 0.6 0.8 HumanEval L-3 L-8 Q-0.6 Q-4 Q-8 Model 0.0 0.2 0.4 0.6 MATH500 L-3 L-8 Q-0.6 Q-4 Q-8 Model 0.0 0.2 0.4 0.6 0.8 MMLU Figure 1.",
          "section": "pdf_page",
          "page": 4,
          "source": "pdf"
        },
        {
          "text": "Specifically, across 5 models and 6 datasets, SAS achieves the highest accuracy in 13 cases (43.3%) and out- performs at least one MAS architecture in 13 additional cases, totaling 26 out of 30 scenarios where SAS matches or exceeds MAS, shown in Figure 1.",
          "section": "pdf_page",
          "page": 4,
          "source": "pdf"
        },
        {
          "text": "On GMAS, as shown in Figure 3, we examine the top entropy-related features ranked by \u00afI.",
          "section": "pdf_page",
          "page": 4,
          "source": "pdf"
        }
      ],
      "scores": {
        "novelty": 0.4,
        "evidence": 1.0,
        "neuroscience": 0.3,
        "section_weight": 0.8,
        "total": 0.6
      }
    },
    {
      "text": "Comparing R = 2 and R = 5, we find that extending delib- eration rarely improves performance and often harms it, even at the cost of higher token consumption, as shown in Figure 5(a).",
      "section": "pdf_page",
      "page": 7,
      "source": "pdf",
      "cues": [
        "we find"
      ],
      "evidence": [
        {
          "text": "On the Uncertainty of Large Language Model-Based Multi-Agent Systems Math500 AIME25 Dataset 0 20 40 60 80 100 Accuracy (%) (a) Qwen3-0.6B Qwen3-4B R=2 R=5 Single Debate Centralized Sequential Hybrid 1 2 3 4 5 Round Number 0 1000 2000 3000 Entropy Value (b) Total Entropy Mean Agent Entropy Max Agent Entropy 0 1000 2000 3000 4000 Round 1 Max Agent Total Entropy 0 5000 10000 15000 20000 Sample Total Entropy (c) SAS Negative MAS Negative SAS Positive MAS Positive 0 5 10 15 20 25 30 35 Total Tokens (100K) Figure 5.",
          "section": "pdf_page",
          "page": 7,
          "source": "pdf"
        },
        {
          "text": "(c) The impact of two prominent entropy features, notable for their high importance (\u00afI) and strong correlation (|\u03c1|) with sample correctness.",
          "section": "pdf_page",
          "page": 7,
          "source": "pdf"
        },
        {
          "text": "Figure 4(c) shows both negatively predict correctness within each architecture.",
          "section": "pdf_page",
          "page": 7,
          "source": "pdf"
        },
        {
          "text": "Surprisingly, Figure 4(d) reveals an inverse trend across architectures: sequential (lowest-performing) shows lowest feature averages, while single (highest-performing) shows highest.",
          "section": "pdf_page",
          "page": 7,
          "source": "pdf"
        },
        {
          "text": "This is further supported by entropy dynamics: as Figure 5(b) shows, key uncertainty metrics, maximum, mean, and total entropy, drop sharply from round 1 to round 2, but remain nearly flat from round 2 to round 5, indicating that agents largely stabilize after the second round.",
          "section": "pdf_page",
          "page": 7,
          "source": "pdf"
        },
        {
          "text": "Despite the expanded feature space with R = 5, early-round uncertainty remains the dominant failure mode, as shown in Figure 5(c).",
          "section": "pdf_page",
          "page": 7,
          "source": "pdf"
        }
      ],
      "scores": {
        "novelty": 0.4,
        "evidence": 1.0,
        "neuroscience": 0.3,
        "section_weight": 0.8,
        "total": 0.6
      }
    },
    {
      "text": "By analyzing 245 features span- ning token-, trajectory-, and round-level entropy, we counterintuitively find that a single agent out- performs MAS in approximately 43.3% of cases, and that uncertainty dynamics are largely deter- mined during the first round of interaction.",